{
  "title_fr": "Offres · Growth System IA · Système d'acquisition et de conversion",
  "title_en": "Offers · Growth System IA · Acquisition and conversion system",
  "description_fr": "Système d'acquisition et de conversion automatisé. Site, CRM, relances, tableaux et contenus, tout connecté pour générer du pipeline mesurable.",
  "description_en": "Automated acquisition and conversion system. Site, CRM, follow-ups, dashboards and content, all connected to generate measurable pipeline.",
  "slug": "growth-system-ia",
  "relatedSolutions": [],
  "relatedOffres": [],
  "relatedCases": [],
  "publishedAt": "2026-05-01T00:00:00.000Z",
  "category": "acquisition",
  "tags": [
    "acquisition-ia",
    "crm",
    "contenu-seo-geo"
  ],
  "tier_fr": "§ Offre phare",
  "tier_en": "§ Flagship offer",
  "tier_label_fr": "Growth System IA",
  "tier_label_en": "Growth System IA",
  "hero_title_html_fr": "Growth System <i class=\"acc\">IA</i>",
  "hero_title_html_en": "Growth System <i class=\"acc\">IA</i>",
  "meta_fr": "Budget indicatif · à partir de 7 000 € HT · 6 à 10 semaines",
  "meta_en": "Indicative budget · from €7,000 ex VAT · 6 to 10 weeks",
  "price_from_eur": 7000,
  "price_to_eur": 10000,
  "duration_min_weeks": 6,
  "duration_max_weeks": 10,
  "cta_label_fr": "Réserver un diagnostic 45 min →",
  "cta_label_en": "Book a 45-min diagnostic →",
  "cta_href": "/contact?offer=growth-system-ia&intent=discovery",
  "faq_fr": [
    {
      "q": "Combien de temps avant que le système produise ses premiers effets ?",
      "a": "Le système est conçu pour se mettre en charge progressivement : landing pages et suivi en ligne dès les premières semaines, puis montée du pipeline éditorial une fois les premiers articles SEO/GEO indexés. Le SEO/GEO reste un canal à effet différé : les positions se construisent sur plusieurs mois. On cadre des attentes réalistes avant de signer plutôt que de promettre un délai garanti."
    },
    {
      "q": "Comment mesurez-vous le résultat ?",
      "a": "On instrumente le suivi dès le départ : pipeline généré rapporté à l'investissement, leads qualifiés par mois, temps de qualification commercial. Ces indicateurs sont câblés dans vos tableaux de pilotage pour que vous mesuriez le système sur vos propres données, pas sur une promesse."
    },
    {
      "q": "Que se passe-t-il si on n'aime pas un livrable ?",
      "a": "Chaque livrable passe par une session de retour avant la livraison suivante. Si une landing page ou un article ne vous convient pas, on le réécrit, inclus dans le forfait, sans surcoût."
    },
    {
      "q": "Vous travaillez sur quels CRM exactement ?",
      "a": "On déploie sur HubSpot (notre préférence pour les PME B2B), Salesforce (pour les structures plus grandes) et Pipedrive (pour les équipes commerciales agiles). Si vous utilisez un autre CRM (Zoho, Freshsales, Monday CRM), on évalue la faisabilité au cadrage, certaines API sont limitées. La migration vers un nouveau CRM n'est pas incluse dans le forfait standard."
    },
    {
      "q": "Et si on a déjà un site qui marche ?",
      "a": "Alors on ne le refond pas. On commence par un audit de 5 jours pour comprendre ce qui génère du pipeline et ce qui reste invisible. Si le site actuel est déjà performant sur certaines pages, on l'optimise. On ne casse pas ce qui marche. La refonte complète n'est recommandée que si l'architecture bloque le pipeline éditorial (CMS sans API, suivi impossible, etc.)."
    },
    {
      "q": "Combien de personnes en interne doivent être impliquées ?",
      "a": "Minimum : 1 interlocuteur côté client (DG ou responsable marketing) disponible 2 heures par semaine pour les validations. La phase de cadrage (semaine 1) demande 3 à 4 heures d'ateliers avec les décideurs. Ensuite, le système tourne de manière largement autonome. La validation éditoriale hebdomadaire prend 30 minutes : vous lisez les articles produits et signez ou demandez un ajustement."
    },
    {
      "q": "Acceptez-vous les missions avec NDA strict ?",
      "a": "Oui. On signe les NDA nécessaires avant de démarrer. Vous gardez un veto absolu sur toute mention de votre nom : rien n'est publié sans votre validation explicite."
    },
    {
      "q": "Quelle est la durée du contrat / engagement ?",
      "a": "Le forfait Growth System IA dure 6 à 10 semaines selon le périmètre. Pas d'abonnement mensuel, pas de reconduction automatique. À la fin, vous disposez d'un système autonome. Si vous voulez poursuivre en production éditoriale ou optimisation continue, on propose un accompagnement mensuel. Il n'est pas obligatoire."
    }
  ],
  "lead_fr": "Votre acquisition dépend d'un site qui n'apprend pas, d'un CRM incomplet et de relances trop tardives. <span>On orchestre le système qui capte, qualifie et réactive le pipeline, et qui rend chaque étape mesurable.</span>",
  "lead_en": "Your acquisition depends on a site that doesn't learn, an incomplete CRM and late follow-ups. <span>We orchestrate the system that captures, qualifies and reactivates pipeline, and makes every step measurable.</span>",
  "problem_statement_fr": "Les leads existent déjà, mais ils fuient entre le site, le CRM et les boîtes mail. <em>Plus vous attendez, plus le pipeline dort et plus la vente coûte cher.</em> On reconnecte les pièces avant d'ajouter du trafic.",
  "problem_statement_en": "Leads already exist, but they leak between the site, CRM and inboxes. <em>The longer you wait, the more pipeline sleeps and the more costly selling becomes.</em> We reconnect the pieces before adding traffic.",
  "problem_annotations": [
    {
      "value": "dès 7 000 €",
      "label_fr": "budget HT indicatif, chiffré au diagnostic",
      "label_en": "indicative ex-VAT budget, priced at diagnostic"
    },
    {
      "value": "6–10",
      "label_fr": "semaines pour livrer le système exploitable",
      "label_en": "weeks to deliver the usable system"
    },
    {
      "value": "Mesuré",
      "label_fr": "pipeline instrumenté de bout en bout",
      "label_en": "pipeline instrumented end to end"
    }
  ],
  "method_aside_fr": "Six à dix semaines pour câbler acquisition, conversion et pilotage. Vous savez avant de signer si le bon point d'entrée est le système complet ou une activation plus légère.",
  "method_aside_en": "Six to ten weeks to wire acquisition, conversion and management. You know before signing whether the right entry point is the full system or a lighter activation.",
  "method_steps": [
    {
      "num": "01",
      "label_fr": "Cartographier votre pipeline réel",
      "label_en": "Map your real pipeline",
      "body_fr": "5 jours d'audit du parcours acquisition → conversion. On identifie les fuites, les goulots, les leads dormants. Livrable : carte du pipeline + plan d'action chiffré.",
      "body_en": "5 days auditing the acquisition → conversion journey. We identify leaks, bottlenecks, dormant leads. Deliverable: pipeline map + costed action plan.",
      "meta_fr": "Audit & cadrage",
      "meta_en": "Audit & scoping"
    },
    {
      "num": "02",
      "label_fr": "Landing pages et SEO/GEO en place",
      "label_en": "Landing pages and SEO/GEO in place",
      "body_fr": "Refonte ou création de landing pages par persona. Pipeline éditorial qui produit du contenu indexable Google et cité par les IA. Tracking complet.",
      "body_en": "Redesign or creation of landing pages by persona. Editorial pipeline producing content indexable by Google and cited by AIs. Complete tracking.",
      "meta_fr": "Site & contenu",
      "meta_en": "Site & content"
    },
    {
      "num": "03",
      "label_fr": "CRM branché, séquences actives",
      "label_en": "CRM connected, sequences active",
      "body_fr": "Intégration CRM, scoring des leads, séquences de nurturing IA et réactivation des contacts dormants.",
      "body_en": "CRM integration, lead scoring, AI nurturing sequences and reactivation of dormant contacts.",
      "meta_fr": "CRM & automation",
      "meta_en": "CRM & automation"
    },
    {
      "num": "04",
      "label_fr": "Tableau de pilotage et passation",
      "label_en": "Management dashboard and handover",
      "body_fr": "Tableau pipeline en temps réel, alertes IA sur les anomalies. Formation équipe et documentation complète pour autonomie totale.",
      "body_en": "Real-time pipeline dashboard, AI alerts on anomalies. Team training and complete documentation for full autonomy.",
      "meta_fr": "Pilotage & livraison",
      "meta_en": "Management & delivery"
    }
  ],
  "deliverables_aside_fr": "Vous gardez la stack quand on part. Pas de captivité.",
  "deliverables_aside_en": "You keep the stack when we leave. No lock-in.",
  "deliverable_items": [
    {
      "title_fr": "Audit pipeline",
      "title_en": "Pipeline audit",
      "body_fr": "Carte du pipeline complet avec chiffrage des fuites et priorisation des quick wins.",
      "body_en": "Complete pipeline map with leak costing and quick win prioritization.",
      "tag": "PDF + ATELIER"
    },
    {
      "title_fr": "Landing pages",
      "title_en": "Landing pages",
      "body_fr": "Pages par persona, optimisées GEO et SEO, tracking complet. Déployées en production.",
      "body_en": "Pages by persona, GEO and SEO optimized, complete tracking. Deployed in production.",
      "tag": "CODE + LIVE"
    },
    {
      "title_fr": "CRM connecté",
      "title_en": "Connected CRM",
      "body_fr": "Scoring des leads, séquences de nurturing et réactivation des contacts dormants configurés.",
      "body_en": "Lead scoring, nurturing sequences and dormant contact reactivation configured.",
      "tag": "CRM"
    },
    {
      "title_fr": "Pipeline éditorial",
      "title_en": "Editorial pipeline",
      "body_fr": "Système de production de contenu IA : articles SEO/GEO, cadence hebdomadaire, templates validés.",
      "body_en": "AI content production system: SEO/GEO articles, weekly cadence, validated templates.",
      "tag": "CONTENU"
    },